{
  "aadp_version": "1.0",
  "id": "example:sample-1",
  "type": "example",
  "checksum": "sha256:b0c501e8c9cdc5d4d6e8cabfd220f47eba81f2f2c7f35147aefe6bd84b0af4e4",
  "updated_at": "2026-07-25T08:00:00Z",
  "canonical_url": "https://example.aadp.dev/e/sample-1",
  "locale": "en",
  "data": {
    "title": "Sample Entity One",
    "description": "A generic AADP v1.0 example entity used for schema conformance testing.",
    "tags": ["sample", "aadp"]
  }
}
